Media URL,Pinterest board,Title,Description,Link,Publish date,Keywords,Alt text
https://raw.githubusercontent.com/sahneo/neobjects-assets/main/Gemini_Generated_Image_n7hnvnn7hnvnn7hn.png,AirPods 4 Bubble Case,Dreamy Bedside Essentials | AirPods 4 Bubble Case,Transform your nightstand with these cozy evening vibes. Enhance your space with organic textures. Nanosuction secure fit for AirPods 4.,https://neobjects.etsy.com?variant=1,2026-03-24 21:47:58,"AirPods case, bedside aesthetic, cozy vibes, nightstand decor, warm lighting, dream room, tech accessories, minimalist home, soft girl aesthetic, lifestyle photography, neutral tones, bedroom inspiration",AirPods 4 Bubble Case - Dreamy Bedside Essentials | AirPods 4 Bubble Case
https://raw.githubusercontent.com/sahneo/neobjects-assets/main/Gemini_Generated_Image_t0o139t0o139t0o1.png,AirPods 4 Bubble Case,Cozy Nightstand Setup: The White Bubble Aesthetic,Transform your nightstand with these cozy evening vibes. A perfect blend of architecture and tech. Nanosuction secure fit for AirPods 4.,https://neobjects.etsy.com?variant=2,2026-03-24 22:02:58,"AirPods case, bedside aesthetic, cozy vibes, nightstand decor, warm lighting, dream room, tech accessories, minimalist home, soft girl aesthetic, lifestyle photography, neutral tones, bedroom inspiration",AirPods 4 Bubble Case - Cozy Nightstand Setup: The White Bubble Aesthetic
https://raw.githubusercontent.com/sahneo/neobjects-assets/main/p1_01.png,AirPods 4 Bubble Case,Morning Light & Matte Ceramic: AirPods 4 Design Vibe,Transform your nightstand with these cozy evening vibes. Feel the satisfying tactile bubble geometry. Nanosuction secure fit for AirPods 4.,https://neobjects.etsy.com?variant=3,2026-03-24 22:17:58,"AirPods case, bedside aesthetic, cozy vibes, nightstand decor, warm lighting, dream room, tech accessories, minimalist home, soft girl aesthetic, lifestyle photography, neutral tones, bedroom inspiration",AirPods 4 Bubble Case - Morning Light & Matte Ceramic: AirPods 4 Design Vibe
https://raw.githubusercontent.com/sahneo/neobjects-assets/main/Gemini_Generated_Image_2n7mzt2n7mzt2n7m.png,AirPods 4 Bubble Case,Sculptural Tech Art: The AirPods 4 Bubble Case in Ceramic,Elevate your audio experience with the unparalleled style of the AirPods 4 Bubble Case. Museum-quality protection for your AirPods 4. Nanosuction secure fit for AirPods 4.,https://neobjects.etsy.com?variant=4,2026-03-24 22:32:58,"AirPods Case, Ceramic Case, Tech Accessory, Aesthetic Tech, Gift Ideas, AirPods 4, White Ceramic, Bubble Texture, Unique Design, Protection, Luxury, Everyday Carry, Stylish, Premium, Audio, Headphone Case, White, Minimalist",AirPods 4 Bubble Case - Sculptural Tech Art: The AirPods 4 Bubble Case in Ceramic
https://raw.githubusercontent.com/sahneo/neobjects-assets/main/p1_01.png,AirPods 4 Bubble Case,The Architectural 'Bubble' Case for AirPods 4,"Elevate your tech with the parametric 'Bubble' case. 🫧

Problem: Most AirPods cases are generic plastic. 
Solution: Our 3D-printed matte ceramic finish offers an organic, high-end texture that feels like a piece of art in your pocket.

Specs: Precision fit for AirPods 4, Nanosuction secure lid, LED-translucent walls.
Care: Wipe with a damp cloth to maintain the matte stone-like finish.",https://neobjects.etsy.com,2026-03-24 19:56:07,"AirPods 4 Case, 3D Printed, Parametric Design, Neo-Deco, Minimalist Tech, Tech Accessories, Designer Case, Architectural Design, Gift for Him, Desk Setup, Apple Accessories",AirPods 4 Bubble Case - The Architectural 'Bubble' Case for AirPods 4
https://raw.githubusercontent.com/sahneo/neobjects-assets/main/p1_02.png,AirPods 4 Bubble Case,Tactile Precision: The AirPods 4 Bubble Texture,"Feel the difference of parametric design. 🖐️

Problem: Smooth cases are slippery and prone to scratches.
Solution: The 'Bubble' geometry provides an ergonomic grip and a satisfying tactile experience unlike any other case on the market.

Specs: High-resolution 3D print, Matte PLA, impact-resistant geometry.
Care: Keep away from extreme heat to preserve the 3D-printed structure.",https://neobjects.etsy.com,2026-03-24 19:57:19,"AirPods 4 Case, 3D Printed, Parametric Design, Neo-Deco, Minimalist Tech, Tech Accessories, Designer Case, Architectural Design, Gift for Him, Desk Setup, Apple Accessories",AirPods 4 Bubble Case - Tactile Precision: The AirPods 4 Bubble Texture
https://raw.githubusercontent.com/sahneo/neobjects-assets/main/p1_03.png,AirPods 4 Bubble Case,Sculptural Protection for Your AirPods 4,"Where high-end art meets everyday utility. 🏛️

Problem: You want protection but hate the 'bulk' of industrial cases.
Solution: Our Neo-Deco inspired design uses organic bubble geometry to distribute impact while maintaining a sleek, museum-quality aesthetic.

Specs: Matte White Ceramic finish, AirPods 4 exclusive fit.
Care: Clean with a soft brush to remove dust from the bubble crevices.",https://neobjects.etsy.com,2026-03-24 20:08:12,"AirPods 4 Case, 3D Printed, Parametric Design, Neo-Deco, Minimalist Tech, Tech Accessories, Designer Case, Architectural Design, Gift for Him, Desk Setup, Apple Accessories",AirPods 4 Bubble Case - Sculptural Protection for Your AirPods 4
